{
  "schema_version": "1.0.0",
  "project_code": "OSS-BLIND-R4",
  "work_item_id": "GRAFANA-133083",
  "feedback_id": "DF-004",
  "target_layer": "testability_gate",
  "feedback_fingerprint": "ee81b4af733c75efd79fffe8ed3b3369353fece3f71ddfd4059e54628a880d18",
  "prepared_at": "2026-09-22T04:42:03.847420+00:00",
  "artifacts": [
    {
      "path": "acceptance/testability_gate.json",
      "before_sha256": "3e77508b9c2274c5aaa0415bba5a48c93ff4eb9b638b7dff2269e363e248c7ce"
    },
    {
      "path": "acceptance/testability_gate.md",
      "before_sha256": "b5e99ac414803b19a3de2a05efc9a92bd88d8df6cf58d35b5689d4304b833311"
    }
  ]
}
